state,abbr,link,homevalue,med_income,fthb,fico,origltv,dti,orignoterate,conv,fha,va,ltv_fico,share_loans_20,share_loans_35,aff_index_20,aff_index_35,agency,hfas,total
United States,US,,269679.892,74190.29,52.5,730,95,38.58,4.179,60.3,24.8,11.2,23,33.6,33.7,20.4,23.44,,2527,1304
Alabama,AL,http://www.ahfa.com/,201216.937,61606.63,49.7,724,96.49,36,4.092,48.4,27.8,15.3,29.9,24.1,43.4,17.91,20.58,the Alabama Housing Finance Authority,17,11
Alaska,AK,https://www.ahfc.us/,308109.069,90185.97,50.6,735,97,39,3.95,41.8,19.1,30.5,25.6,20,51.9,19.41,22.3,the Alaska Housing Finance Corp.,17,6
Arizona,AZ,https://housing.az.gov/,258353.857,66545.47,48.6,727,95,39,4.35,62.6,23.8,12.2,22.2,34.5,32.2,22.36,25.7,the Arizona Department of Housing,45,32
Arkansas,AR,http://adfa.arkansas.gov/,179028.603,56829.64,50.7,720,96.38,35.93,4.068,47.1,26.5,12.7,30.4,23.8,45.3,17.03,19.57,the Arkansas Development Finance Authority,13,4
California,CA,http://www.calhfa.ca.gov/,437732.385,81171.22,55.3,732,90,42,4.237,64.3,25.5,9.4,18.9,43.4,27.6,35.73,41.06,the California Housing Finance Agency,397,241
Colorado,CO,https://www.chfainfo.com/,352726.392,83998.24,46.8,743,90,40,4.223,65.1,19.7,13.9,18.6,40.6,30.6,24.96,28.68,the Colorado Housing and Finance Authority,90,31
Connecticut,CT,http://www.chfa.org,265670.771,97025.25,61.8,732,95,39,4.061,62.8,29.1,6.1,21.4,32.8,31.2,15.27,17.55,the Connecticut Housing Finance Agency,36,16
Delaware,DE,http://www.destatehousing.com,272228.495,79928.57,49.6,736,95,38,4.172,58.3,26.5,9.9,24.5,35.8,36.1,17.75,20.4,the Delaware State Housing Authority,22,7
District of Columbia,DC,http://www.dchfa.org,495860.419,101408.43,64.7,764,85,36,4.154,84.6,8.6,6.8,6,43.7,15.6,34.2,39.3,the District of Columbia Housing Finance Agency,256,113
Florida,FL,http://www.floridahousing.org,252621.666,63681.2,50.8,724,94.99,40,4.262,58.9,26.8,12.8,22.9,35.6,31.7,21.5,24.7,the Florida Housing Finance Corporation,72,31
Georgia,GA,http://www.dca.ga.gov,239122.425,67241.52,53.2,722,95,38,4.151,53.1,29.4,14,28.8,28.5,40.3,18.29,21.01,the Georgia Department of Community Affairs/Georgia Housing Finance Authority,7,4
Hawaii,HI,http://www.hawaii.gov/dbedt/hhfdc,530287.206,90862.93,52,750,90,42,4.061,60.2,6.7,27.5,12.9,41.1,32.8,36.71,42.18,the Hawaii Housing Finance and Development Corporation,20,8
Idaho,ID,http://www.idahohousing.com,237453.915,65428.43,43.9,731,95,38,4.023,62.7,20.8,11.8,22.4,33.9,30.1,21.44,24.64,the Idaho Housing and Finance Association,45,23
Illinois,IL,http://www.ihda.org,231085.425,79790.63,57.5,732,94.04,38,4.173,68,24,5.9,20.7,34.7,26.9,15.17,17.43,the Illinois Housing Development Authority,30,14
Indiana,IN,http://www.ihcda.in.gov,177517.968,68867.85,52.9,718,95,35.87,4.217,55.8,29,8.2,29.5,26.4,39,14.52,16.68,the Indiana Housing and Community Development Authority,25,10
Iowa,IA,http://www.iowafinanceauthority.gov,189597.013,73775.26,49.2,736,95,35.23,4.036,69.7,16,8.6,20.4,33.3,30.6,12.65,14.53,the Iowa Finance Authority,15,11
Kansas,KS,http://www.kshousingcorp.org,197430.112,72025.76,49.9,731,95,36,4.094,58,24.9,12.7,24,26.5,37.7,16.02,18.41,the Kansas Housing Resources Corporation,27,10
Kentucky,KY,http://www.kyhousing.org,186619.307,60603.1,52.9,719,95,36,4.171,51.6,27.9,10.7,29.5,27,42.2,15.81,18.16,the Kentucky Housing Corporation,32,14
Louisiana,LA,http://www.lhc.la.gov,215767.4,59050.9,56.2,714,96.49,38,4.194,48,29.3,11.1,32.4,24.5,44.4,20.29,23.31,the Louisiana Housing Corporation,9,3
Maine,ME,http://www.mainehousing.org,234172.048,71104.13,48.2,731,95,38,4.121,56.7,22.2,12,24.5,33.3,36.8,21.27,24.44,MaineHousing,91,27
Maryland,MD,http://www.dhcd.maryland.gov,324921.274,99423.4,58.9,729,95,39.59,4.129,52.1,31.4,12.8,27.4,25.7,41.8,17.63,20.26,the Maryland Department of Housing and Community Development,82,57
Massachusetts,MA,http://www.masshousing.com,364245.368,99359.68,58,737,90,39,4.106,71.1,22,5.5,17.1,39.5,24.5,22.84,26.24,the MassHousing,44,26
Michigan,MI,http://www.michigan.gov/mshda,193168.052,70011.89,52.4,726,95,36,4.231,67.6,21.3,6.3,22.5,32,33.4,14.68,16.87,the Michigan State Housing Development Authority,39,29
Minnesota,MN,http://www.mnhousing.gov,246901.985,86102.15,51.5,741,95,37,4.098,69.9,19.2,6.6,18.1,32.8,29.7,15.97,18.34,Minnesota Housing,16,7
Mississippi,MS,http://www.mshomecorp.com,183425.074,53885.83,54.6,708,96.745,37,4.061,38.3,33.6,14.4,36.2,20,46.8,20.92,24.03,Mississippi Home Corporation,28,10
Missouri,MO,http://www.mhdc.com,191641.349,67230.15,49.6,729,95,36,4.138,56.1,26.1,10.3,26,29,37.8,16.45,18.9,the Missouri Housing Development Commission,14,5
Montana,MT,http://www.housing.mt.gov,262449.387,68609.46,43.3,744,91.57,38,4.028,64.5,15.2,13.6,17.3,37.9,31.5,22.98,26.4,the Montana Board of Housing/Housing Division,14,4
Nebraska,NE,http://www.nifa.org,198452.759,74961.33,51.5,738,95,36,4.029,64.1,19.6,12,20.2,30.4,34.7,13.96,16.04,the Nebraska Investment Finance Authority,24,11
Nevada,NV,http://www.housing.nv.gov,281286.481,68004.39,52,722,95,40,4.372,58.7,26.5,13.9,22.5,33.6,34.8,23.78,27.33,the Nevada Housing Division,9,3
New Hampshire,NH,http://www.nhhfa.org,272323.172,91122.41,52.3,736,95,39.555,4.129,63.4,23.1,9.8,20,33.4,33.7,17.3,19.87,the New Hampshire Housing Finance Authority,46,31
New Jersey,NJ,http://www.nj-hmfa.com,324377.798,97973.61,59.9,735,90,40,4.164,65.4,29.2,4.3,18.8,41,24.3,18.02,20.71,the New Jersey Housing and Mortgage Finance Agency,16,9
New Mexico,NM,http://www.housingnm.org,220290.888,58076.86,53,724,95,38,4.191,52.2,29.8,15.9,27.7,28.5,32.6,20.63,23.7,the New Mexico Mortgage Finance Authority,97,63
New York,NY,http://www.nyshcr.org,320343.872,80253.05,62.5,739,90,39.56,4.124,67.1,25.8,5.6,17.1,42.4,24.2,23.57,27.08,New York State Homes and Community Renewal,59,34
North Carolina,NC,http://www.nchfa.com,240713.963,64269.19,46.4,739,94,36.51,4.146,62,17.2,15.5,20.6,34.5,33.4,20.11,23.11,the North Carolina Housing Finance Agency,7,1
North Dakota,ND,http://www.ndhfa.org,250051.214,79840.89,46.5,746,94,36.555,3.977,67.8,15,13.5,16.3,35.2,29.2,17,19.53,the North Dakota Housing Finance Agency,50,30
Ohio,OH,http://www.ohiohome.org,177839.77,69287.73,55.3,723,95,36.73,4.192,58.2,28.5,9,26.5,27.5,36.5,13.29,15.27,the Ohio Housing Finance Agency,34,22
Oklahoma,OK,http://www.ohfa.org,186308.351,62398.19,49.4,720,96.49,36.605,4.169,46.4,28.8,14.7,29.7,24.6,44.4,15.66,17.99,the Oklahoma Housing Finance Agency,37,29
Oregon,OR,http://www.ohcs.oregon.gov,325452.295,74132.97,47,745,90,39,4.188,68.8,17.4,10.5,16.1,43.3,25.6,26.37,30.3,Oregon Housing and Community Services,83,45
Pennsylvania,PA,http://www.phfa.org,221780.989,75575.23,57.5,736,95,37,4.128,60.3,28.3,7.6,22.6,31.7,34.1,15.44,17.74,the Pennsylvania Housing Finance Agency,12,5
Rhode Island,RI,http://www.rhodeislandhousing.org,266769.264,80730.14,59.5,727,95,40,4.129,54.6,38.5,6.4,26,31.4,36.3,18.75,21.54,Rhode Island Housing,31,17
South Carolina,SC,http://www.schousing.com,228179.597,63828.71,46,729,95,37.51,4.165,56.4,22.5,15.7,25.6,31.5,38.1,19.35,22.24,the South Carolina State Housing Finance and Development Authority,12,5
South Dakota,SD,http://www.sdhda.org,209430.154,71962.1,50,741,95,37,3.92,56,18.2,13,20,28,35.6,19.28,22.15,the South Dakota Housing Development Authority,34,12
Tennessee,TN,http://www.thda.org,233019.526,63145.25,46.5,729,95,37,4.13,53.7,24.2,13.7,25.5,30.9,38.5,18.32,21.05,the Tennessee Housing Development Agency,186,89
Texas,TX,http://www.tdhca.state.tx.us,257358.802,68895.21,51.4,724,95,39.76,4.213,57.5,28.4,12.8,26.4,33.4,35.1,20.88,23.99,the Texas Department of Housing and Community Affairs,29,14
Utah,UT,http://www.utahhousingcorp.org,291352.267,77644.88,48.3,738,95,39,4.16,63.6,25.4,7.3,20.3,30.9,34.2,21.67,24.9,the Utah Housing Corporation,14,8
Vermont,VT,http://www.vhfa.org,245106.082,77726.44,48.3,748,90,37.96,4.046,73.4,12.7,8,14.6,41.3,27.3,17.77,20.42,the Vermont Housing Finance Agency,44,25
Virginia,VA,http://www.vhda.com,318550.933,86096.38,54.5,738,95,38.83,4.089,51.3,22.7,22,24.1,27.6,42.9,20.51,23.56,the Virginia Housing Development Authority,64,27
Washington,WA,http://www.wshfc.org,351260.392,85103.65,52.5,737,93.61,39,4.193,64.6,18.6,14.7,19.9,36.5,33,25.12,28.86,the Washington State Housing Finance Commission,19,3
West Virginia,WV,http://www.wvhdf.com,177699.042,58926.06,55.9,714,96.5,35.91,4.162,45.3,23.5,14.8,31.7,22.3,48.2,19.26,22.13,the West Virginia Housing Development Fund,13,6
Wisconsin,WI,http://www.wheda.com,204632.306,75775.15,51.2,741,94,36,4.11,73.8,14.9,7.5,18.4,34.3,28.7,13.41,15.41,the Wisconsin Housing and Economic Development Authority,48,26
Wyoming,WY,http://www.wyomingcda.com,250152.108,75214.11,44.5,736,95,37.515,3.967,52.3,18,17.5,23.7,27.2,41.7,18.91,21.72,the Wyoming Community Development Authority,12,2
,,,,,,,,,,,,,,,,,,,,
Max,,,530287.206,101408.43,64.7,764,97,42,4.372,84.6,38.5,30.5,36.2,43.7,51.9,36.71,42.18,0,397,241
Min,,,177517.968,53885.83,43.3,708,85,35.23,3.92,38.3,6.7,4.3,6,20,15.6,12.65,14.53,0,7,1
,,,,,,,,,,,,,,,,,,,,
,diff,,352769.238,47522.6,21.4,56,12,6.77,0.452,46.3,31.8,26.2,30.2,23.7,36.3,24.06,27.65,0,390,240
,/5,,70553.8476,9504.52,4.28,11.2,2.4,1.354,0.0904,9.26,6.36,5.24,6.04,4.74,7.26,4.812,5.53,0,78,48
,min,,177517.968,53885.83,43.3,708,85,35.23,3.92,38.3,6.7,4.3,6,20,15.6,12.65,14.53,0,7,1
,q1,,248072,63390,48,719,87,37,4,48,13,10,12,25,23,17,20,0,85,49
,q2,,318626,72895,52,730,89,38,4,57,19,15,18,30,30,22,26,0,163,97
,q3,,389180,82400,56,741,91,39,4,66,25,20,24,35,37,27,32,0,241,145
,q4,,459734,91905,60,752,93,40,4,75,31,25,30,40,44,32,38,0,319,193
,max,,530287.8476,101409.52,64.28,763.2,95.4,41.354,4.0904,84.26,37.36,30.24,36.04,44.74,51.26,36.812,43.53,0,397,241